{"schema_version":"unirouter.source-evidence.request-set.v1","campaign_id":"source-evidence-conformance-20300101","source_instance":"unirouter-conformance-source","frozen_at":"2030-01-01T00:00:00Z","requests":[{"scenario_id":"chat-success","request_id":"req-conformance-chat-001","org_id":101,"project_id":201}],"limits":{"max_requests":20,"max_facts":200}}